Title,Abstract
The Stretch to Stray on Time: Resonant Length of Random Walks in a Transient,"  First-passage times in random walks have a vast number of diverse
applications in physics, chemistry, biology, and finance. In general,
environmental conditions for a stochastic process are not constant on the time
scale of the average first-passage time, or control might be applied to reduce
noise. We investigate moments of the first-passage time distribution under a
transient describing relaxation of environmental conditions. We solve the
Laplace-transformed (generalized) master equation analytically using a novel
method that is applicable to general state schemes. The first-passage time from
one end to the other of a linear chain of states is our application for the
solutions. The dependence of its average on the relaxation rate obeys a power
law for slow transients. The exponent $\nu$ depends on the chain length $N$
like $\nu=-N/(N+1)$ to leading order. Slow transients substantially reduce the
noise of first-passage times expressed as the coefficient of variation (CV),
even if the average first-passage time is much longer than the transient. The
CV has a pronounced minimum for some lengths, which we call resonant lengths.
These results also suggest a simple and efficient noise control strategy, and
are closely related to the timing of repetitive excitations, coherence
resonance and information transmission by noisy excitable systems. A resonant
number of steps from the inhibited state to the excitation threshold and slow
recovery from negative feedback provide optimal timing noise reduction and
information transmission.
"
Explaining Parochialism: A Causal Account for Political Polarization in Changing Economic Environments,"  Political and social polarization are a significant cause of conflict and
poor governance in many societies, thus understanding their causes is of
considerable importance. Here we demonstrate that shifts in socialization
strategy similar to political polarization and/or identity politics could be a
constructive response to periods of apparent economic decline. We start from
the observation that economies, like ecologies are seldom at equilibrium.
Rather, they often suffer both negative and positive shocks. We show that even
where in an expanding economy, interacting with diverse out-groups can afford
benefits through innovation and exploration, if that economy contracts, a
strategy of seeking homogeneous groups can be important to maintaining
individual solvency. This is true even where the expected value of out group
interaction exceeds that of in group interactions. Our account unifies what
were previously seen as conflicting explanations: identity threat versus
economic anxiety. Our model indicates that in periods of extreme deprivation,
cooperation with diversity again becomes the best (in fact, only viable)
strategy. However, our model also shows that while polarization may increase
gradually in response to shifts in the economy, gradual decrease of
polarization may not be an available strategy; thus returning to previous
levels of cooperation may require structural change.
"
General multilevel Monte Carlo methods for pricing discretely monitored Asian options,"  We describe general multilevel Monte Carlo methods that estimate the price of
an Asian option monitored at $m$ fixed dates. Our approach yields unbiased
estimators with standard deviation $O(\epsilon)$ in $O(m + (1/\epsilon)^{2})$
expected time for a variety of processes including the Black-Scholes model,
Merton's jump-diffusion model, the Square-Root diffusion model, Kou's double
exponential jump-diffusion model, the variance gamma and NIG exponential Levy
processes and, via the Milstein scheme, processes driven by scalar stochastic
differential equations. Using the Euler scheme, our approach estimates the
Asian option price with root mean square error $O(\epsilon)$ in
$O(m+(\ln(\epsilon)/\epsilon)^{2})$ expected time for processes driven by
multidimensional stochastic differential equations. Numerical experiments
confirm that our approach outperforms the conventional Monte Carlo method by a
factor of order $m$.
"
Instantaneous Arbitrage and the CAPM,"  This paper studies the concept of instantaneous arbitrage in continuous time
and its relation to the instantaneous CAPM. Absence of instantaneous arbitrage
is equivalent to the existence of a trading strategy which satisfies the CAPM
beta pricing relation in place of the market. Thus the difference between the
arbitrage argument and the CAPM argument in Black and Scholes (1973) is this:
the arbitrage argument assumes that there exists some portfolio satisfying the
capm equation, whereas the CAPM argument assumes, in addition, that this
portfolio is the market portfolio.
"
A six-factor asset pricing model,"  The present study introduce the human capital component to the Fama and
French five-factor model proposing an equilibrium six-factor asset pricing
model. The study employs an aggregate of four sets of portfolios mimicking size
and industry with varying dimensions. The first set consists of three set of
six portfolios each sorted on size to B/M, size to investment, and size to
momentum. The second set comprises of five index portfolios, third, a four-set
of twenty-five portfolios each sorted on size to B/M, size to investment, size
to profitability, and size to momentum, and the final set constitute thirty
industry portfolios. To estimate the parameters of six-factor asset pricing
model for the four sets of variant portfolios, we use OLS and Generalized
method of moments based robust instrumental variables technique (IVGMM). The
results obtained from the relevance, endogeneity, overidentifying restrictions,
and the Hausman's specification, tests indicate that the parameter estimates of
the six-factor model using IVGMM are robust and performs better than the OLS
approach. The human capital component shares equally the predictive power
alongside the factors in the framework in explaining the variations in return
on portfolios. Furthermore, we assess the t-ratio of the human capital
component of each IVGMM estimates of the six-factor asset pricing model for the
four sets of variant portfolios. The t-ratio of the human capital of the
eighty-three IVGMM estimates are more than 3.00 with reference to the standard
proposed by Harvey et al. (2016). This indicates the empirical success of the
six-factor asset-pricing model in explaining the variation in asset returns.
"
Particle-without-Particle: a practical pseudospectral collocation method for linear partial differential equations with distributional sources,"  Partial differential equations with distributional sources---in particular,
involving (derivatives of) delta distributions---have become increasingly
ubiquitous in numerous areas of physics and applied mathematics. It is often of
considerable interest to obtain numerical solutions for such equations, but any
singular (""particle""-like) source modeling invariably introduces nontrivial
computational obstacles. A common method to circumvent these is through some
form of delta function approximation procedure on the computational grid;
however, this often carries significant limitations on the efficiency of the
numerical convergence rates, or sometimes even the resolvability of the problem
at all.
In this paper, we present an alternative technique for tackling such
equations which avoids the singular behavior entirely: the
""Particle-without-Particle"" method. Previously introduced in the context of the
self-force problem in gravitational physics, the idea is to discretize the
computational domain into two (or more) disjoint pseudospectral
(Chebyshev-Lobatto) grids such that the ""particle"" is always at the interface
between them; thus, one only needs to solve homogeneous equations in each
domain, with the source effectively replaced by jump (boundary) conditions
thereon. We prove here that this method yields solutions to any linear PDE the
source of which is any linear combination of delta distributions and
derivatives thereof supported on a one-dimensional subspace of the problem
domain. We then implement it to numerically solve a variety of relevant PDEs:
hyperbolic (with applications to neuroscience and acoustics), parabolic (with
applications to finance), and elliptic. We generically obtain improved
convergence rates relative to typical past implementations relying on delta
function approximations.
"
Capital Regulation under Price Impacts and Dynamic Financial Contagion,"  We construct a continuous time model for price-mediated contagion
precipitated by a common exogenous stress to the trading book of all firms in
the financial system. In this setting, firms are constrained so as to satisfy a
risk-weight based capital ratio requirement. We use this model to find
analytical bounds on the risk-weights for an asset as a function of the market
liquidity. Under these appropriate risk-weights, we find existence and
uniqueness for the joint system of firm behavior and the asset price. We
further consider an analytical bound on the firm liquidations, which allows us
to construct exact formulas for stress testing the financial system with
deterministic or random stresses. Numerical case studies are provided to
demonstrate various implications of this model and analytical bounds.
"
Spreading of an infectious disease between different locations,"  The endogenous adaptation of agents, that may adjust their local contact
network in response to the risk of being infected, can have the perverse effect
of increasing the overall systemic infectiveness of a disease. We study a
dynamical model over two geographically distinct but interacting locations, to
better understand theoretically the mechanism at play. Moreover, we provide
empirical motivation from the Italian National Bovine Database, for the period
2006-2013.
"
Improving Stock Movement Prediction with Adversarial Training,"  This paper contributes a new machine learning solution for stock movement
prediction, which aims to predict whether the price of a stock will be up or
down in the near future. The key novelty is that we propose to employ
adversarial training to improve the generalization of a recurrent neural
network model. The rationality of adversarial training here is that the input
features to stock prediction are typically based on stock price, which is
essentially a stochastic variable and continuously changed with time by nature.
As such, normal training with stationary price-based features (e.g. the closing
price) can easily overfit the data, being insufficient to obtain reliable
models. To address this problem, we propose to add perturbations to simulate
the stochasticity of continuous price variable, and train the model to work
well under small yet intentional perturbations. Extensive experiments on two
real-world stock data show that our method outperforms the state-of-the-art
solution with 3.11% relative improvements on average w.r.t. accuracy, verifying
the usefulness of adversarial training for stock prediction task. Codes will be
made available upon acceptance.
"
Scaling Limits for Super--replication with Transient Price Impact,"  We prove limit theorems for the super-replication cost of European options in
a Binomial model with transient price impact. We show that if the time step
goes to zero and the effective resilience between consecutive trading times
remains constant then the limit of the super--replication prices coincide with
the scaling limit for temporary price impact with a modified market depth.
"
Fast swaption pricing in Gaussian term structure models,"  We propose a fast and accurate numerical method for pricing European
swaptions in multi-factor Gaussian term structure models. Our method can be
used to accelerate the calibration of such models to the volatility surface.
The pricing of an interest rate option in such a model involves evaluating a
multi-dimensional integral of the payoff of the claim on a domain where the
payoff is positive. In our method, we approximate the exercise boundary of the
state space by a hyperplane tangent to the maximum probability point on the
boundary and simplify the multi-dimensional integration into an analytical
form. The maximum probability point can be determined using the gradient
descent method. We demonstrate that our method is superior to previous methods
by comparing the results to the price obtained by numerical integration.
"
Opinion Dynamics via Search Engines (and other Algorithmic Gatekeepers),"  Ranking algorithms are the information gatekeepers of the Internet era. We
develop a stylized model to study the effects of ranking algorithms on opinion
dynamics. We consider a search engine that uses an algorithm based on
popularity and on personalization. We find that popularity-based rankings
generate an advantage of the fewer effect: fewer websites reporting a given
signal attract relatively more traffic overall. This highlights a novel,
ranking-driven channel that explains the diffusion of misinformation, as
websites reporting incorrect information may attract an amplified amount of
traffic precisely because they are few. Furthermore, when individuals provide
sufficiently positive feedback to the ranking algorithm, popularity-based
rankings tend to aggregate information while personalization acts in the
opposite direction.
"
Optimal proportional reinsurance and investment for stochastic factor models,"  In this work we investigate the optimal proportional reinsurance-investment
strategy of an insurance company which wishes to maximize the expected
exponential utility of its terminal wealth in a finite time horizon. Our goal
is to extend the classical Cramer-Lundberg model introducing a stochastic
factor which affects the intensity of the claims arrival process, described by
a Cox process, as well as the insurance and reinsurance premia. Using the
classical stochastic control approach based on the Hamilton-Jacobi-Bellman
equation we characterize the optimal strategy and provide a verification result
for the value function via classical solutions of two backward partial
differential equations. Existence and uniqueness of these solutions are
discussed. Results under various premium calculation principles are illustrated
and a new premium calculation rule is proposed in order to get more realistic
strategies and to better fit our stochastic factor model. Finally, numerical
simulations are performed to obtain sensitivity analyses.
"
Endogeneous Dynamics of Intraday Liquidity,"  In this paper we investigate the endogenous information contained in four
liquidity variables at a five minutes time scale on equity markets around the
world: the traded volume, the bid-ask spread, the volatility and the volume at
first limits of the orderbook. In the spirit of Granger causality, we measure
the level of information by the level of accuracy of linear autoregressive
models. This empirical study is carried out on a dataset of more than 300
stocks from four different markets (US, UK, Japan and Hong Kong) from a period
of over five years. We discuss the obtained performances of autoregressive (AR)
models on stationarized versions of the variables, focusing on explaining the
observed differences between stocks.
Since empirical studies are often conducted at this time scale, we believe it
is of paramount importance to document endogenous dynamics in a simple
framework with no addition of supplemental information. Our study can hence be
used as a benchmark to identify exogenous effects. On the other hand, most
optimal trading frameworks (like the celebrated Almgren and Chriss one), focus
on computing an optimal trading speed at a frequency close to the one we
consider. Such frameworks very often take i.i.d. assumptions on liquidity
variables; this paper document the auto-correlations emerging from real data,
opening the door to new developments in optimal trading.
"
Trends in the Diffusion of Misinformation on Social Media,"  We measure trends in the diffusion of misinformation on Facebook and Twitter
between January 2015 and July 2018. We focus on stories from 570 sites that
have been identified as producers of false stories. Interactions with these
sites on both Facebook and Twitter rose steadily through the end of 2016.
Interactions then fell sharply on Facebook while they continued to rise on
Twitter, with the ratio of Facebook engagements to Twitter shares falling by
approximately 60 percent. We see no similar pattern for other news, business,
or culture sites, where interactions have been relatively stable over time and
have followed similar trends on the two platforms both before and after the
election.
"
Evaluation of equity-based debt obligations,"  We consider a class of participation rights, i.e. obligations issued by a
company to investors who are interested in performance-based compensation.
Albeit having desirable economic properties equity-based debt obligations
(EbDO) pose challenges in accounting and contract pricing. We formulate and
solve the associated mathematical problem in a discrete time, as well as a
continuous time setting. In the latter case the problem is reduced to a
forward-backward stochastic differential equation (FBSDE) and solved using the
method of decoupling fields.
"
Option Pricing Models Driven by the Space-Time Fractional Diffusion: Series Representation and Applications,"  In this paper, we focus on option pricing models based on space-time
fractional diffusion. We briefly revise recent results which show that the
option price can be represented in the terms of rapidly converging
double-series and apply these results to the data from real markets. We focus
on estimation of model parameters from the market data and estimation of
implied volatility within the space-time fractional option pricing models.
"
Unravelling Airbnb Predicting Price for New Listing,"  This paper analyzes Airbnb listings in the city of San Francisco to better
understand how different attributes such as bedrooms, location, house type
amongst others can be used to accurately predict the price of a new listing
that optimal in terms of the host's profitability yet affordable to their
guests. This model is intended to be helpful to the internal pricing tools that
Airbnb provides to its hosts. Furthermore, additional analysis is performed to
ascertain the likelihood of a listings availability for potential guests to
consider while making a booking. The analysis begins with exploring and
examining the data to make necessary transformations that can be conducive for
a better understanding of the problem at large while helping us make
hypothesis. Moving further, machine learning models are built that are
intuitive to use to validate the hypothesis on pricing and availability and run
experiments in that context to arrive at a viable solution. The paper then
concludes with a discussion on the business implications, associated risks and
future scope.
"
Optimal portfolio selection in an It-Markov additive market,"  We study a portfolio selection problem in a continuous-time It-Markov
additive market with prices of financial assets described by Markov additive
processes which combine Lvy processes and regime switching models. Thus the
model takes into account two sources of risk: the jump diffusion risk and the
regime switching risk. For this reason the market is incomplete. We complete
the market by enlarging it with the use of a set of Markovian jump securities,
Markovian power-jump securities and impulse regime switching securities.
Moreover, we give conditions under which the market is
asymptotic-arbitrage-free. We solve the portfolio selection problem in the
It-Markov additive market for the power utility and the logarithmic utility.
"
Optimal hedging under fast-varying stochastic volatility,"  In a market with a rough or Markovian mean-reverting stochastic volatility
there is no perfect hedge. Here it is shown how various delta-type hedging
strategies perform and can be evaluated in such markets. A precise
characterization of the hedging cost, the replication cost caused by the
volatility fluctuations, is presented in an asymptotic regime of rapid mean
reversion for the volatility fluctuations. The optimal dynamic asset based
hedging strategy in the considered regime is identified as the so-called
`practitioners' delta hedging scheme. It is moreover shown that the
performances of the delta-type hedging schemes are essentially independent of
the regularity of the volatility paths in the considered regime and that the
hedging costs are related to a vega risk martingale whose magnitude is
proportional to a new market risk parameter.
"
Computation of optimal transport and related hedging problems via penalization and neural networks,"  This paper presents a widely applicable approach to solving (multi-marginal,
martingale) optimal transport and related problems via neural networks. The
core idea is to penalize the optimization problem in its dual formulation and
reduce it to a finite dimensional one which corresponds to optimizing a neural
network with smooth objective function. We present numerical examples from
optimal transport, martingale optimal transport, portfolio optimization under
uncertainty and generative adversarial networks that showcase the generality
and effectiveness of the approach.
"
The Italian Pension Gap: a Stochastic Optimal Control Approach,"  We study the gap between the state pension provided by the Italian pension
system pre-Dini reform and post-Dini reform. The goal is to fill the gap
between the old and the new pension by joining a defined contribution pension
scheme and adopting an optimal investment strategy that is target-based. We
find that it is possible to cover, at least partially, this gap with the
additional income of the pension scheme, especially in the presence of late
retirement and in the presence of stagnant career. Workers with dynamic career
and workers who retire early are those who are most penalised by the reform.
Results are intuitive and in line with previous studies on the subject.
"
"Health Care Expenditures, Financial Stability, and Participation in the Supplemental Nutrition Assistance Program (SNAP)","  This paper examines the association between household healthcare expenses and
participation in the Supplemental Nutrition Assistance Program (SNAP) when
moderated by factors associated with financial stability of households. Using a
large longitudinal panel encompassing eight years, this study finds that an
inter-temporal increase in out-of-pocket medical expenses increased the
likelihood of household SNAP participation in the current period. Financially
stable households with precautionary financial assets to cover at least 6
months worth of household expenses were significantly less likely to
participate in SNAP. The low income households who recently experienced an
increase in out of pocket medical expenses but had adequate precautionary
savings were less likely than similar households who did not have precautionary
savings to participate in SNAP. Implications for economists, policy makers, and
household finance professionals are discussed.
"
Technological Parasitism,"  Technological parasitism is a new theory to explain the evolution of
technology in society. In this context, this study proposes a model to analyze
the interaction between a host technology (system) and a parasitic technology
(subsystem) to explain evolutionary pathways of technologies as complex
systems. The coefficient of evolutionary growth of the model here indicates the
typology of evolution of parasitic technology in relation to host technology:
i.e., underdevelopment, growth and development. This approach is illustrated
with realistic examples using empirical data of product and process
technologies. Overall, then, the theory of technological parasitism can be
useful for bringing a new perspective to explain and generalize the evolution
of technology and predict which innovations are likely to evolve rapidly in
society.
"
Asynchronous stochastic price pump,"  We propose a model for equity trading in a population of agents where each
agent acts to achieve his or her target stock-to-bond ratio, and, as a feedback
mechanism, follows a market adaptive strategy. In this model only a fraction of
agents participates in buying and selling stock during a trading period, while
the rest of the group accepts the newly set price. Using numerical simulations
we show that the stochastic process settles on a stationary regime for the
returns. The mean return can be greater or less than the return on the bond and
it is determined by the parameters of the adaptive mechanism. When the number
of interacting agents is fixed, the distribution of the returns follows the
log-normal density. In this case, we give an analytic formula for the mean rate
of return in terms of the rate of change of agents' risk levels and confirm the
formula by numerical simulations. However, when the number of interacting
agents per period is random, the distribution of returns can significantly
deviate from the log-normal, especially as the variance of the distribution for
the number of interacting agents increases.
"
A path integral based model for stocks and order dynamics,"  We introduce a model for the short-term dynamics of financial assets based on
an application to finance of quantum gauge theory, developing ideas of Ilinski.
We present a numerical algorithm for the computation of the probability
distribution of prices and compare the results with APPLE stocks prices and the
S&P500 index.
"
