Title,Abstract
Trading algorithms with learning in latent alpha models,"  Alpha signals for statistical arbitrage strategies are often driven by latent
factors. This paper analyses how to optimally trade with latent factors that
cause prices to jump and diffuse. Moreover, we account for the effect of the
trader's actions on quoted prices and the prices they receive from trading.
Under fairly general assumptions, we demonstrate how the trader can learn the
posterior distribution over the latent states, and explicitly solve the latent
optimal trading problem. We provide a verification theorem, and a methodology
for calibrating the model by deriving a variation of the
expectation-maximization algorithm. To illustrate the efficacy of the optimal
strategy, we demonstrate its performance through simulations and compare it to
strategies which ignore learning in the latent factors. We also provide
calibration results for a particular model using Intel Corporation stock as an
example.
"
Parameter Learning and Change Detection Using a Particle Filter With Accelerated Adaptation,"  This paper presents the construction of a particle filter, which incorporates
elements inspired by genetic algorithms, in order to achieve accelerated
adaptation of the estimated posterior distribution to changes in model
parameters. Specifically, the filter is designed for the situation where the
subsequent data in online sequential filtering does not match the model
posterior filtered based on data up to a current point in time. The examples
considered encompass parameter regime shifts and stochastic volatility. The
filter adapts to regime shifts extremely rapidly and delivers a clear heuristic
for distinguishing between regime shifts and stochastic volatility, even though
the model dynamics assumed by the filter exhibit neither of those features.
"
PROOF OF VALUE ALIENATION (PoVA) - a concept of a cryptocurrency issuance protocol,"  In this paper, we will describe a concept of a cryptocurrency issuance
protocol which supports digital currencies in a Proof-of-Work (< PoW >) like
manner. However, the methods assume alternative utilization of assets used for
cryptocurrency creation (rather than purchasing electricity necessary for <
mining >).
"
Zero-Inflated Autoregressive Conditional Duration Model for Discrete Trade Durations with Excessive Zeros,"  In finance, durations between successive transactions are usually modeled by
the autoregressive conditional duration model based on a continuous
distribution omitting frequent zero values. Zero durations can be caused by
either split transactions or independent transactions. We propose a discrete
model allowing for excessive zero values based on the zero-inflated negative
binomial distribution with score dynamics. We establish the invertibility of
the score filter. Additionally, we derive sufficient conditions for the
consistency and asymptotic normality of the maximum likelihood of the model
parameters. In an empirical study of DJIA stocks, we find that split
transactions cause on average 63% of zero values. Furthermore, the loss of
decimal places in the proposed model is less severe than incorrect treatment of
zero values in continuous models.
"
A Numerical Study of Carr and Lee's Correlation Immunization Strategy for Volatility Derivatives,"  In their seminal work `Robust Replication of Volatility Derivatives,' Carr
and Lee show how to robustly price and replicate a variety of claims written on
the quadratic variation of a risky asset under the assumption that the asset's
volatility process is independent of the Brownian motion that drives the
asset's price. Additionally, they propose a correlation immunization method
that minimizes the pricing and hedging error that results when the correlation
between the risky asset's price and volatility is nonzero. In this paper, we
perform a number of Monte Carlo experiments to test the effectiveness of Carr
and Lee's immunization strategy. Our results indicate that the correlation
immunization method is an effective means of reducing pricing and hedging
errors that result from nonzero correlation.
"
Stochastic comparisons of the largest claim amounts from two sets of interdependent heterogeneous portfolios,"  Let $ X_{\lambda_1},\ldots,X_{\lambda_n}$ be dependent non-negative random
variables and $Y_i=I_{p_i} X_{\lambda_i}$, $i=1,\ldots,n$, where
$I_{p_1},\ldots,I_{p_n}$ are independent Bernoulli random variables independent
of $X_{\lambda_i}$'s, with ${\rm E}[I_{p_i}]=p_i$, $i=1,\ldots,n$. In actuarial
sciences, $Y_i$ corresponds to the claim amount in a portfolio of risks. In
this paper, we compare the largest claim amounts of two sets of interdependent
portfolios, in the sense of usual stochastic order, when the variables in one
set have the parameters $\lambda_1,\ldots,\lambda_n$ and $p_1,\ldots,p_n$ and
the variables in the other set have the parameters
$\lambda^{*}_1,\ldots,\lambda^{*}_n$ and $p^*_1,\ldots,p^*_n$. For
illustration, we apply the results to some important models in actuary.
"
Statistical estimation of superhedging prices,"  We consider statistical estimation of superhedging prices using historical
stock returns in a frictionless market with d traded assets. We introduce a
simple plugin estimator based on empirical measures, show it is consistent but
lacks suitable robustness. This is addressed by our improved estimators which
use a larger set of martingale measures defined through a tradeoff between the
radius of Wasserstein balls around the empirical measure and the allowed norm
of martingale densities. We also study convergence rates, convergence of
superhedging strategies, and our study extends, in part, to the case of a
market with traded options and to a multiperiod setting.
"
Will a Large Economy Be Stable?,"  We study networks of firms with Leontief production functions. Relying on
results from Random Matrix Theory, we argue that such networks generically
become unstable when their size increases, or when the heterogeneity in
productivities/connectivities becomes too strong. At marginal stability and for
large heterogeneities, we find that the distribution of firm sizes develops a
power-law tail, as observed empirically. Crises can be triggered by small
idiosyncratic shocks, which lead to ""avalanches"" of defaults characterized by a
power-law distribution of total output losses. We conjecture that evolutionary
and behavioural forces conspire to keep the economy close to marginal
stability. This scenario would naturally explain the well-known ""small shocks,
large business cycles"" puzzle, as anticipated long ago by Bak, Chen, Scheinkman
and Woodford.
"
A Markov Chain Model for the Cure Rate of Non-Performing Loans,"  A Markov-chain model is developed for the purpose estimation of the cure rate
of non-performing loans. The technique is performed collectively, on portfolios
and it can be applicable in the process of calculation of credit impairment. It
is efficient in terms of data manipulation costs which makes it accessible even
to smaller financial institutions. In addition, several other applications to
portfolio optimization are suggested.
"
Kinetic Theory for Finance Brownian Motion from Microscopic Dynamics,"  Recent technological development has enabled researchers to study social
phenomena scientifically in detail and financial markets has particularly
attracted physicists since the Brownian motion has played the key role as in
physics. In our previous report (arXiv:1703.06739; to appear in Phys. Rev.
Lett.), we have presented a microscopic model of trend-following high-frequency
traders (HFTs) and its theoretical relation to the dynamics of financial
Brownian motion, directly supported by a data analysis of tracking trajectories
of individual HFTs in a financial market. Here we show the mathematical
foundation for the HFT model paralleling to the traditional kinetic theory in
statistical physics. We first derive the time-evolution equation for the
phase-space distribution for the HFT model exactly, which corresponds to the
Liouville equation in conventional analytical mechanics. By a systematic
reduction of the Liouville equation for the HFT model, the
Bogoliubov-Born-Green-Kirkwood-Yvon hierarchal equations are derived for
financial Brownian motion. We then derive the Boltzmann-like and Langevin-like
equations for the order-book and the price dynamics by making the assumption of
molecular chaos. The qualitative behavior of the model is asymptotically
studied by solving the Boltzmann-like and Langevin-like equations for the large
number of HFTs, which is numerically validated through the Monte-Carlo
simulation. Our kinetic description highlights the parallel mathematical
structure between the financial Brownian motion and the physical Brownian
motion.
"
Trading Strategies Generated by Path-dependent Functionals of Market Weights,"  Almost twenty years ago, E.R. Fernholz introduced portfolio generating
functions which can be used to construct a variety of portfolios, solely in the
terms of the individual companies' market weights. I. Karatzas and J. Ruf
recently developed another methodology for the functional construction of
portfolios, which leads to very simple conditions for strong relative arbitrage
with respect to the market. In this paper, both of these notions of functional
portfolio generation are generalized in a pathwise, probability-free setting;
portfolio generating functions are substituted by path-dependent functionals,
which involve the current market weights, as well as additional
bounded-variation functions of past and present market weights. This
generalization leads to a wider class of functionally-generated portfolios than
was heretofore possible, and yields improved conditions for outperforming the
market portfolio over suitable time-horizons.
"
Geert Hofstede et al's set of national cultural dimensions - popularity and criticisms,"  This article outlines different stages in development of the national culture
model, created by Geert Hofstede and his affiliates. This paper reveals and
synthesizes the contemporary review of the application spheres of this
framework. Numerous applications of the dimensions set are used as a source of
identifying significant critiques, concerning different aspects in model's
operation. These critiques are classified and their underlying reasons are also
outlined by means of a fishbone diagram.
"
A Machine Learning Framework for Stock Selection,"  This paper demonstrates how to apply machine learning algorithms to
distinguish good stocks from the bad stocks. To this end, we construct 244
technical and fundamental features to characterize each stock, and label stocks
according to their ranking with respect to the return-to-volatility ratio.
Algorithms ranging from traditional statistical learning methods to recently
popular deep learning method, e.g. Logistic Regression (LR), Random Forest
(RF), Deep Neural Network (DNN), and the Stacking, are trained to solve the
classification task. Genetic Algorithm (GA) is also used to implement feature
selection. The effectiveness of the stock selection strategy is validated in
Chinese stock market in both statistical and practical aspects, showing that:
1) Stacking outperforms other models reaching an AUC score of 0.972; 2) Genetic
Algorithm picks a subset of 114 features and the prediction performances of all
models remain almost unchanged after the selection procedure, which suggests
some features are indeed redundant; 3) LR and DNN are radical models; RF is
risk-neutral model; Stacking is somewhere between DNN and RF. 4) The portfolios
constructed by our models outperform market average in back tests.
"
Distributions of Historic Market Data -- Implied and Realized Volatility,"  We undertake a systematic comparison between implied volatility, as
represented by VIX (new methodology) and VXO (old methodology), and realized
volatility. We compare visually and statistically distributions of realized and
implied variance (volatility squared) and study the distribution of their
ratio. We find that the ratio is best fitted by heavy-tailed -- lognormal and
fat-tailed (power-law) -- distributions, depending on whether preceding or
concurrent month of realized variance is used. We do not find substantial
difference in accuracy between VIX and VXO. Additionally, we study the variance
of theoretical realized variance for Heston and multiplicative models of
stochastic volatility and compare those with realized variance obtained from
historic market data.
"
Academic Engagement and Commercialization in an Institutional Transition Environment: Evidence from Shanghai Maritime University,"  Does academic engagement accelerate or crowd out the commercialization of
university knowledge? Research on this topic seldom considers the impact of the
institutional environment, especially when a formal institution for encouraging
the commercial activities of scholars has not yet been established. This study
investigates this question in the context of China, which is in the
institutional transition stage. Based on a survey of scholars from Shanghai
Maritime University, we demonstrate that academic engagement has a positive
impact on commercialization and that this impact is greater for risk-averse
scholars than for other risk-seeking scholars. Our results suggest that in an
institutional transition environment, the government should consider
encouraging academic engagement to stimulate the commercialization activities
of conservative scholars.
"
Multi-agent Economics and the Emergence of Critical Markets,"  The dual crises of the sub-prime mortgage crisis and the global financial
crisis has prompted a call for explanations of non-equilibrium market dynamics.
Recently a promising approach has been the use of agent based models (ABMs) to
simulate aggregate market dynamics. A key aspect of these models is the
endogenous emergence of critical transitions between equilibria, i.e. market
collapses, caused by multiple equilibria and changing market parameters.
Several research themes have developed microeconomic based models that include
multiple equilibria: social decision theory (Brock and Durlauf), quantal
response models (McKelvey and Palfrey), and strategic complementarities
(Goldstein). A gap that needs to be filled in the literature is a unified
analysis of the relationship between these models and how aggregate criticality
emerges from the individual agent level. This article reviews the agent-based
foundations of markets starting with the individual agent perspective of
McFadden and the aggregate perspective of catastrophe theory emphasising
connections between the different approaches. It is shown that changes in the
uncertainty agents have in the value of their interactions with one another,
even if these changes are one-sided, plays a central role in systemic market
risks such as market instability and the twin crises effect. These interactions
can endogenously cause crises that are an emergent phenomena of markets.
"
"Private Information, Credit Risk and Graph Structure in P2P Lending Networks","  This research investigated the potential for improving Peer-to-Peer (P2P)
credit scoring by using ""private information"" about communications and travels
of borrowers. We found that P2P borrowers' ego networks exhibit scale-free
behavior driven by underlying preferential attachment mechanisms that connect
borrowers in a fashion that can be used to predict loan profitability. The
projection of these private networks onto networks of mobile phone
communication and geographical locations from mobile phone GPS potentially give
loan providers access to private information through graph and location metrics
which we used to predict loan profitability. Graph topology was found to be an
important predictor of loan profitability, explaining over 5.5% of variability.
Networks of borrower location information explain an additional 19% of the
profitability. Machine learning algorithms were applied to the data set
previously analyzed to develop the predictive model and resulted in a 4%
reduction in mean squared error.
"
Quantum Blockchain using entanglement in time,"  A conceptual design for a quantum blockchain is proposed. Our method involves
encoding the blockchain into a temporal GHZ (Greenberger-Horne-Zeilinger) state
of photons that do not simultaneously coexist. It is shown that the
entanglement in time, as opposed to an entanglement in space, provides the
crucial quantum advantage. All the subcomponents of this system have already
been shown to be experimentally realized. Perhaps more shockingly, our encoding
procedure can be interpreted as non-classically influencing the past; hence
this decentralized quantum blockchain can be viewed as a quantum networked time
machine.
"
Assessing the effect of advertising expenditures upon sales: a Bayesian structural time series model,"  We propose a robust implementation of the Nerlove--Arrow model using a
Bayesian structural time series model to explain the relationship between
advertising expenditures of a country-wide fast-food franchise network with its
weekly sales. Thanks to the flexibility and modularity of the model, it is well
suited to generalization to other markets or situations. Its Bayesian nature
facilitates incorporating \emph{a priori} information (the manager's views),
which can be updated with relevant data. This aspect of the model will be used
to present a strategy of budget scheduling across time and channels.
"
Effects of a Price limit Change on Market Stability at the Intraday Horizon in the Korean Stock Market,"  This paper investigates the effects of a price limit change on the volatility
of the Korean stock market's (KRX) intraday stock price process. Based on the
most recent transaction data from the KRX, which experienced a change in the
price limit on June 15, 2015, we examine the change in realized variance after
the price limit change to investigate the overall effects of the change on the
intraday market volatility. We then analyze the effects in more detail by
applying the discrete Fourier transform (DFT) to the data set. We find evidence
that the market becomes more volatile in the intraday horizon because of the
increase in the amplitudes of the low-frequency components of the price
processes after the price limit change. Therefore, liquidity providers are in a
worse situation than they were prior to the change.
"
Herding behavior in cryptocurrency markets,"  There are no solid arguments to sustain that digital currencies are the
future of online payments or the disruptive technology that some of its former
participants declared when used to face critiques. This paper aims to solve the
cryptocurrency puzzle from a behavioral finance perspective by finding the
parallelism between biases present in financial markets that could be applied
to cryptomarkets. Moreover, it is suggested that cryptocurrencies' prices are
driven by herding, hence this study test herding behavior under asymmetric and
symmetric conditions and the existence of different herding regimes by
employing the Markov-Switching approach.
"
Disentangling and Assessing Uncertainties in Multiperiod Corporate Default Risk Predictions,"  Measuring the corporate default risk is broadly important in economics and
finance. Quantitative methods have been developed to predictively assess future
corporate default probabilities. However, as a more difficult yet crucial
problem, evaluating the uncertainties associated with the default predictions
remains little explored. In this paper, we attempt to fill this blank by
developing a procedure for quantifying the level of associated uncertainties
upon carefully disentangling multiple contributing sources. Our framework
effectively incorporates broad information from historical default data,
corporates' financial records, and macroeconomic conditions by a)
characterizing the default mechanism, and b) capturing the future dynamics of
various features contributing to the default mechanism. Our procedure overcomes
the major challenges in this large scale statistical inference problem and
makes it practically feasible by using parsimonious models, innovative methods,
and modern computational facilities. By predicting the marketwide total number
of defaults and assessing the associated uncertainties, our method can also be
applied for evaluating the aggregated market credit risk level. Upon analyzing
a US market data set, we demonstrate that the level of uncertainties associated
with default risk assessments is indeed substantial. More informatively, we
also find that the level of uncertainties associated with the default risk
predictions is correlated with the level of default risks, indicating potential
for new scopes in practical applications including improving the accuracy of
default risk assessments.
"
Inferring short-term volatility indicators from Bitcoin blockchain,"  In this paper, we study the possibility of inferring early warning indicators
(EWIs) for periods of extreme bitcoin price volatility using features obtained
from Bitcoin daily transaction graphs. We infer the low-dimensional
representations of transaction graphs in the time period from 2012 to 2017
using Bitcoin blockchain, and demonstrate how these representations can be used
to predict extreme price volatility events. Our EWI, which is obtained with a
non-negative decomposition, contains more predictive information than those
obtained with singular value decomposition or scalar value of the total Bitcoin
transaction volume.
"
A sparse grid approach to balance sheet risk measurement,"  In this work, we present a numerical method based on a sparse grid
approximation to compute the loss distribution of the balance sheet of a
financial or an insurance company. We first describe, in a stylised way, the
assets and liabilities dynamics that are used for the numerical estimation of
the balance sheet distribution. For the pricing and hedging model, we chose a
classical Black & Scholes model with a stochastic interest rate following a
Hull & White model. The risk management model describing the evolution of the
parameters of the pricing and hedging model is a Gaussian model. The new
numerical method is compared with the traditional nested simulation approach.
We review the convergence of both methods to estimate the risk indicators under
consideration. Finally, we provide numerical results showing that the sparse
grid approach is extremely competitive for models with moderate dimension.
"
Option market (in)efficiency and implied volatility dynamics after return jumps,"  In informationally efficient financial markets, option prices and this
implied volatility should immediately be adjusted to new information that
arrives along with a jump in underlying's return, whereas gradual changes in
implied volatility would indicate market inefficiency. Using minute-by-minute
data on S&P 500 index options, we provide evidence regarding delayed and
gradual movements in implied volatility after the arrival of return jumps.
These movements are directed and persistent, especially in the case of negative
return jumps. Our results are significant when the implied volatilities are
extracted from at-the-money options and out-of-the-money puts, while the
implied volatility obtained from out-of-the-money calls converges to its new
level immediately rather than gradually. Thus, our analysis reveals that the
implied volatility smile is adjusted to jumps in underlying's return
asymmetrically. Finally, it would be possible to have statistical arbitrage in
zero-transaction-cost option markets, but under actual option price spreads,
our results do not imply abnormal option returns.
"
Thought Viruses and Asset Prices,"  We use insights from epidemiology, namely the SIR model, to study how agents
infect each other with ""investment ideas."" Once an investment idea ""goes
viral,"" equilibrium prices exhibit the typical ""fever peak,"" which is
characteristic for speculative excesses. Using our model, we identify a time
line of symptoms that indicate whether a boom is in its early or later stages.
Regarding the market's top, we find that prices start to decline while the
number of infected agents, who buy the asset, is still rising. Moreover, the
presence of fully rational agents (i) accelerates booms (ii) lowers peak prices
and (iii) produces broad, drawn-out, market tops.
"
Defining and estimating stochastic rate change in a dynamic general insurance portfolio,"  Rate change calculations in the literature involve deterministic methods that
measure the change in premium for a given policy. The definition of rate change
as a statistical parameter is proposed to address the stochastic nature of the
premium charged for a policy. It promotes the idea that rate change is a
property of an asymptotic population to be estimated, not just a property to
measure or monitor in the sample of observed policies that are written. Various
models and techniques are given for estimating this stochastic rate change and
quantifying the uncertainty in the estimates. The use of matched sampling is
emphasized for rate change estimation, as it adjusts for changes in policy
characteristics by directly searching for similar policies across policy years.
This avoids any of the assumptions and recipes that are required to re-rate
policies in years where they were not written, as is common with deterministic
methods. Such procedures can be subjective or implausible if the structure of
rating algorithms change or there are complex and heterogeneous exposure bases
and coverages. The methods discussed are applied to a motor premium database.
The application includes the use of a genetic algorithm with parallel
computations to automatically optimize the matched sampling.
"
