Title,Abstract
Are multi-factor Gaussian term structure models still useful? An empirical analysis on Italian BTPs,"  In this paper, we empirically study models for pricing Italian sovereign
bonds under a reduced form framework, by assuming different dynamics for the
short-rate process. We analyze classical Cox-Ingersoll-Ross and Vasicek
multi-factor models, with a focus on optimization algorithms applied in the
calibration exercise. The Kalman filter algorithm together with a maximum
likelihood estimation method are considered to fit the Italian term-structure
over a 12-year horizon, including the global financial crisis and the euro area
sovereign debt crisis. Analytic formulas for the gradient vector and the
Hessian matrix of the likelihood function are provided.
"
High Dimensional Estimation and Multi-Factor Models,"  This paper re-investigates the estimation of multiple factor models relaxing
the convention that the number of factors is small and using a new approach for
identifying factors. We first obtain the collection of all possible factors and
then provide a simultaneous test, security by security, of which factors are
significant. Since the collection of risk factors is large and highly
correlated, high-dimension methods (including the LASSO and prototype
clustering) have to be used. The multi-factor model is shown to have a
significantly better fit than the Fama-French 5-factor model. Robustness tests
are also provided.
"
An Expanded Local Variance Gamma model,"  The paper proposes an expanded version of the Local Variance Gamma model of
Carr and Nadtochiy by adding drift to the governing underlying process. Still
in this new model it is possible to derive an ordinary differential equation
for the option price which plays a role of Dupire's equation for the standard
local volatility model. It is shown how calibration of multiple smiles (the
whole local volatility surface) can be done in such a case. Further, assuming
the local variance to be a piecewise linear function of strike and piecewise
constant function of time this ODE is solved in closed form in terms of
Confluent hypergeometric functions. Calibration of the model to market smiles
does not require solving any optimization problem and, in contrast, can be done
term-by-term by solving a system of non-linear algebraic equations for each
maturity, which is fast.
"
Psychological model of the investor and manager behavior in risk,"  All people have to make risky decisions in everyday life. And we do not know
how true they are. But is it possible to mathematically assess the correctness
of our choice? This article discusses the model of decision making under risk
on the example of project management. This is a game with two players, one of
which is Investor, and the other is the Project Manager. Each player makes a
risky decision for himself, based on his past experience. With the help of a
mathematical model, the players form a level of confidence, depending on who
the player accepts the strategy or does not accept. The project manager
assesses the costs and compares them with the level of confidence. An investor
evaluates past results. Also visit the case where the strategy of the player
accepts the part.
"
Failure of Smooth Pasting Principle and Nonexistence of Equilibrium Stopping Rules under Time-Inconsistency,"  This paper considers a time-inconsistent stopping problem in which the
inconsistency arises from non-constant time preference rates. We show that the
smooth pasting principle, the main approach that has been used to construct
explicit solutions for conventional time-consistent optimal stopping problems,
may fail under time-inconsistency. Specifically, we prove that the smooth
pasting principle solves a time-inconsistent problem within the intra-personal
game theoretic framework if and only if a certain inequality on the model
primitives is satisfied. We show that the violation of this inequality can
happen even for very simple non-exponential discount functions. Moreover, we
demonstrate that the stopping problem does not admit any intra-personal
equilibrium whenever the smooth pasting principle fails. The ""negative"" results
in this paper caution blindly extending the classical approaches for
time-consistent stopping problems to their time-inconsistent counterparts.
"
Cryptoasset Factor Models,"  We propose factor models for the cross-section of daily cryptoasset returns
and provide source code for data downloads, computing risk factors and
backtesting them out-of-sample. In ""cryptoassets"" we include all
cryptocurrencies and a host of various other digital assets (coins and tokens)
for which exchange market data is available. Based on our empirical analysis,
we identify the leading factor that appears to strongly contribute into daily
cryptoasset returns. Our results suggest that cross-sectional statistical
arbitrage trading may be possible for cryptoassets subject to efficient
executions and shorting.
"
Exploring the predictability of range-based volatility estimators using RNNs,"  We investigate the predictability of several range-based stock volatility
estimators, and compare them to the standard close-to-close estimator which is
most commonly acknowledged as the volatility. The patterns of volatility
changes are analyzed using LSTM recurrent neural networks, which are a state of
the art method of sequence learning. We implement the analysis on all current
constituents of the Dow Jones Industrial Average index, and report averaged
evaluation results. We find that changes in the values of range-based
estimators are more predictable than that of the estimator using daily closing
values only.
"
"Expropriations, Property Confiscations and New Offshore Entities: Evidence from the Panama Papers","  Using the Panama Papers, we show that the beginning of media reporting on
expropriations and property confiscations in a country increases the
probability that offshore entities are incorporated by agents from the same
country in the same month. This result is robust to the use of country-year
fixed effects and the exclusion of tax havens. Further analysis shows that the
effect is driven by countries with non-corrupt and effective governments, which
supports the notion that offshore entities are incorporated when reasonably
well-intended and well-functioning governments become more serious about
fighting organized crime by confiscating proceeds of crime.
"
Affine Rough Models,"  The goal of this survey article is to explain and elucidate the affine
structure of recent models appearing in the rough volatility literature, and
show how it leads to exponential-affine transform formulas.
"
A Game of Tax Evasion: evidences from an agent-based model,"  This paper presents a simple agent-based model of an economic system,
populated by agents playing different games according to their different view
about social cohesion and tax payment. After a first set of simulations,
correctly replicating results of existing literature, a wider analysis is
presented in order to study the effects of a dynamic-adaptation rule, in which
citizens may possibly decide to modify their individual tax compliance
according to individual criteria, such as, the strength of their ethical
commitment, the satisfaction gained by consumption of the public good and the
perceived opinion of neighbors. Results show the presence of thresholds levels
in the composition of society - between taxpayers and evaders - which explain
the extent of damages deriving from tax evasion.
"
Structural changes in the interbank market across the financial crisis from multiple core-periphery analysis,"  Interbank markets are often characterised in terms of a core-periphery
network structure, with a highly interconnected core of banks holding the
market together, and a periphery of banks connected mostly to the core but not
internally. This paradigm has recently been challenged for short time scales,
where interbank markets seem better characterised by a bipartite structure with
more core-periphery connections than inside the core. Using a novel
core-periphery detection method on the eMID interbank market, we enrich this
picture by showing that the network is actually characterised by multiple
core-periphery pairs. Moreover, a transition from core-periphery to bipartite
structures occurs by shortening the temporal scale of data aggregation. We
further show how the global financial crisis transformed the market, in terms
of composition, multiplicity and internal organisation of core-periphery pairs.
By unveiling such a fine-grained organisation and transformation of the
interbank market, our method can find important applications in the
understanding of how distress can propagate over financial networks.
"
On the complexity of solving a decision problem with flow-depending costs: the case of the IJsselmeer dikes,"  We consider a fundamental integer programming (IP) model for cost-benefit
analysis flood protection through dike building in the Netherlands, due to
Verweij and Zwaneveld.
Experimental analysis with data for the Ijsselmeer lead to integral optimal
solution of the linear programming relaxation of the IP model.
This naturally led to the question of integrality of the polytope associated
with the IP model.
In this paper we first give a negative answer to this question by
establishing non-integrality of the polytope.
Second, we establish natural conditions that guarantee the linear programming
relaxation of the IP model to be integral.
We then test the most recent data on flood probabilities, damage and
investment costs of the IJsselmeer for these conditions.
Third, we show that the IP model can be solved in polynomial time when the
number of dike segments, or the number of feasible barrier heights, are
constant.
"
Mining Illegal Insider Trading of Stocks: A Proactive Approach,"  Illegal insider trading of stocks is based on releasing non-public
information (e.g., new product launch, quarterly financial report, acquisition
or merger plan) before the information is made public. Detecting illegal
insider trading is difficult due to the complex, nonlinear, and non-stationary
nature of the stock market. In this work, we present an approach that detects
and predicts illegal insider trading proactively from large heterogeneous
sources of structured and unstructured data using a deep-learning based
approach combined with discrete signal processing on the time series data. In
addition, we use a tree-based approach that visualizes events and actions to
aid analysts in their understanding of large amounts of unstructured data.
Using existing data, we have discovered that our approach has a good success
rate in detecting illegal insider trading patterns.
"
Mean-variance portfolio selection under partial information with drift uncertainty,"  This paper studies a mean-variance portfolio selection problem under partial
information with drift uncertainty. It is proved that all the contingent claims
in this model are attainable in the sense of Xiong and Zhou. Further, we
propose a numerical scheme to approximate the optimal portfolio. Malliavin
calculus and the strong law of large numbers play important roles in this
scheme.
"
Generalizing Geometric Brownian Motion,"  To convert standard Brownian motion $Z$ into a positive process, Geometric
Brownian motion (GBM) $e^{\beta Z_t}, \beta >0$ is widely used. We generalize
this positive process by introducing an asymmetry parameter $ \alpha \geq 0$
which describes the instantaneous volatility whenever the process reaches a new
low. For our new process, $\beta$ is the instantaneous volatility as prices
become arbitrarily high. Our generalization preserves the positivity, constant
proportional drift, and tractability of GBM, while expressing the instantaneous
volatility as a randomly weighted $L^2$ mean of $\alpha$ and $\beta$. The
running minimum and relative drawup of this process are also analytically
tractable. Letting $\alpha = \beta$, our positive process reduces to Geometric
Brownian motion. By adding a jump to default to the new process, we introduce a
non-negative martingale with the same tractabilities. Assuming a security's
dynamics are driven by these processes in risk neutral measure, we price
several derivatives including vanilla, barrier and lookback options.
"
Pricing options and computing implied volatilities using neural networks,"  This paper proposes a data-driven approach, by means of an Artificial Neural
Network (ANN), to value financial options and to calculate implied volatilities
with the aim of accelerating the corresponding numerical methods. With ANNs
being universal function approximators, this method trains an optimized ANN on
a data set generated by a sophisticated financial model, and runs the trained
ANN as an agent of the original solver in a fast and efficient way. We test
this approach on three different types of solvers, including the analytic
solution for the Black-Scholes equation, the COS method for the Heston
stochastic volatility model and Brent's iterative root-finding method for the
calculation of implied volatilities. The numerical results show that the ANN
solver can reduce the computing time significantly.
"
Social Network based Short-Term Stock Trading System,"  This paper proposes a novel adaptive algorithm for the automated short-term
trading of financial instrument. The algorithm adopts a semantic sentiment
analysis technique to inspect the Twitter posts and to use them to predict the
behaviour of the stock market. Indeed, the algorithm is specifically developed
to take advantage of both the sentiment and the past values of a certain
financial instrument in order to choose the best investment decision. This
allows the algorithm to ensure the maximization of the obtainable profits by
trading on the stock market. We have conducted an investment simulation and
compared the performance of our proposed with a well-known benchmark (DJTATO
index) and the optimal results, in which an investor knows in advance the
future price of a product. The result shows that our approach outperforms the
benchmark and achieves the performance score close to the optimal result.
"
Identification of Conduit Countries and Community Structures in the Withholding Tax Networks,"  Due to economic globalization, each country's economic law, including tax
laws and tax treaties, has been forced to work as a single network. However,
each jurisdiction (country or region) has not made its economic law under the
assumption that its law functions as an element of one network, so it has
brought unexpected results. We thought that the results are exactly
international tax avoidance. To contribute to the solution of international tax
avoidance, we tried to investigate which part of the network is vulnerable.
Specifically, focusing on treaty shopping, which is one of international tax
avoidance methods, we attempt to identified which jurisdiction are likely to be
used for treaty shopping from tax liabilities and the relationship between
jurisdictions which are likely to be used for treaty shopping and others. For
that purpose, based on withholding tax rates imposed on dividends, interest,
and royalties by jurisdictions, we produced weighted multiple directed graphs,
computed the centralities and detected the communities. As a result, we
clarified the jurisdictions that are likely to be used for treaty shopping and
pointed out that there are community structures. The results of this study
suggested that fewer jurisdictions need to introduce more regulations for
prevention of treaty abuse worldwide.
"
International crop trade networks: The impact of shocks and cascades,"  Analyzing available FAO data from 176 countries over 21 years, we observe an
increase of complexity in the international trade of maize, rice, soy, and
wheat. A larger number of countries play a role as producers or intermediaries,
either for trade or food processing. In consequence, we find that the trade
networks become more prone to failure cascades caused by exogenous shocks. In
our model, countries compensate for demand deficits by imposing export
restrictions. To capture these, we construct higher-order trade dependency
networks for the different crops and years. These networks reveal hidden
dependencies between countries and allow to discuss policy implications.
"
Dynamical regularities of US equities opening and closing auctions,"  We first investigate the evolution of opening and closing auctions volumes of
US equities along the years. We then report dynamical properties of pre-auction
periods: the indicative match price is strongly mean-reverting because the
imbalance is; the final auction price reacts to a single auction order
placement or cancellation in markedly different ways in the opening and closing
auctions when computed conditionally on imbalance improving or worsening
events; the indicative price reverts towards the mid price of the regular limit
order book but is not especially bound to the spread.
"
Quantum Structures in Human Decision-making: Towards Quantum Expected Utility,"  {\it Ellsberg thought experiments} and empirical confirmation of Ellsberg
preferences pose serious challenges to {\it subjective expected utility theory}
(SEUT). We have recently elaborated a quantum-theoretic framework for human
decisions under uncertainty which satisfactorily copes with the Ellsberg
paradox and other puzzles of SEUT. We apply here the quantum-theoretic
framework to the {\it Ellsberg two-urn example}, showing that the paradox can
be explained by assuming a state change of the conceptual entity that is the
object of the decision ({\it decision-making}, or {\it DM}, {\it entity}) and
representing subjective probabilities by quantum probabilities. We also model
the empirical data we collected in a DM test on human participants within the
theoretic framework above. The obtained results are relevant, as they provide a
line to model real life, e.g., financial and medical, decisions that show the
same empirical patterns as the two-urn experiment.
"
Transition probability of Brownian motion in the octant and its application to default modeling,"  We derive a semi-analytic formula for the transition probability of
three-dimensional Brownian motion in the positive octant with absorption at the
boundaries. Separation of variables in spherical coordinates leads to an
eigenvalue problem for the resulting boundary value problem in the two angular
components. The main theoretical result is a solution to the original problem
expressed as an expansion into special functions and an eigenvalue which has to
be chosen to allow a matching of the boundary condition. We discuss and test
several computational methods to solve a finite-dimensional approximation to
this nonlinear eigenvalue problem. Finally, we apply our results to the
computation of default probabilities and credit valuation adjustments in a
structural credit model with mutual liabilities.
"
The Wisdom of a Kalman Crowd,"  The Kalman Filter has been called one of the greatest inventions in
statistics during the 20th century. Its purpose is to measure the state of a
system by processing the noisy data received from different electronic sensors.
In comparison, a useful resource for managers in their effort to make the right
decisions is the wisdom of crowds. This phenomenon allows managers to combine
judgments by different employees to get estimates that are often more accurate
and reliable than estimates, which managers produce alone. Since harnessing the
collective intelligence of employees, and filtering signals from multiple noisy
sensors appear related, we looked at the possibility of using the Kalman Filter
on estimates by people. Our predictions suggest, and our findings based on the
Survey of Professional Forecasters reveal, that the Kalman Filter can help
managers solve their decision-making problems by giving them stronger signals
before they choose. Indeed, when used on a subset of forecasters identified by
the Contribution Weighted Model, the Kalman Filter beat that rule clearly,
across all the forecasting horizons in the survey.
"
Status maximization as a source of fairness in a networked dictator game,"  Human behavioural patterns exhibit selfish or competitive, as well as
selfless or altruistic tendencies, both of which have demonstrable effects on
human social and economic activity. In behavioural economics, such effects have
traditionally been illustrated experimentally via simple games like the
dictator and ultimatum games. Experiments with these games suggest that, beyond
rational economic thinking, human decision-making processes are influenced by
social preferences, such as an inclination to fairness. In this study we
suggest that the apparent gap between competitive and altruistic human
tendencies can be bridged by assuming that people are primarily maximising
their status, i.e., a utility function different from simple profit
maximisation. To this end we analyse a simple agent-based model, where
individuals play the repeated dictator game in a social network they can
modify. As model parameters we consider the living costs and the rate at which
agents forget infractions by others. We find that individual strategies used in
the game vary greatly, from selfish to selfless, and that both of the above
parameters determine when individuals form complex and cohesive social
networks.
"
Affine forward variance models,"  We introduce the class of affine forward variance (AFV) models of which both
the conventional Heston model and the rough Heston model are special cases. We
show that AFV models can be characterized by the affine form of their cumulant
generating function, which can be obtained as solution of a convolution Riccati
equation. We further introduce the class of affine forward order flow intensity
(AFI) models, which are structurally similar to AFV models, but driven by jump
processes, and which include Hawkes-type models. We show that the cumulant
generating function of an AFI model satisfies a generalized convolution Riccati
equation and that a high-frequency limit of AFI models converges in
distribution to the AFV model.
"
"The role of industry, occupation, and location specific knowledge in the survival of new firms","  How do regions acquire the knowledge they need to diversify their economic
activities? How does the migration of workers among firms and industries
contribute to the diffusion of that knowledge? Here we measure the industry,
occupation, and location-specific knowledge carried by workers from one
establishment to the next using a dataset summarizing the individual work
history for an entire country. We study pioneer firms--firms operating in an
industry that was not present in a region--because the success of pioneers is
the basic unit of regional economic diversification. We find that the growth
and survival of pioneers increase significantly when their first hires are
workers with experience in a related industry, and with work experience in the
same location, but not with past experience in a related occupation. We compare
these results with new firms that are not pioneers and find that
industry-specific knowledge is significantly more important for pioneer than
non-pioneer firms. To address endogeneity we use Bartik instruments, which
leverage national fluctuations in the demand for an activity as shocks for
local labor supply. The instrumental variable estimates support the finding
that industry-related knowledge is a predictor of the survival and growth of
pioneer firms. These findings expand our understanding of the micro-mechanisms
underlying regional economic diversification events.
"
The Broad Consequences of Narrow Banking,"  We investigate the macroeconomic consequences of narrow banking in the
context of stock-flow consistent models. We begin with an extension of the
Goodwin-Keen model incorporating time deposits, government bills, cash, and
central bank reserves to the base model with loans and demand deposits and use
it to describe a fractional reserve banking system. We then characterize narrow
banking by a full reserve requirement on demand deposits and describe the
resulting separation between the payment system and lending functions of the
resulting banking sector. By way of numerical examples, we explore the
properties of fractional and full reserve versions of the model and compare
their asymptotic properties. We find that narrow banking does not lead to any
loss in economic growth when the models converge to a finite equilibrium, while
allowing for more direct monitoring and prevention of financial breakdowns in
the case of explosive asymptotic behaviour.
"
